{
  "agent": "trajectories",
  "task": "cube",
  "scene_file": "scenes/kitchen2.xml",
  "barriers": [
  ],
  "learning_rate": 0.01,
  "n_iter": 1000,
  "first_frame_iter": 1000,
  "boundary_radius": 0.1,
  "hand_boundary_radius": 0.1,
  "new_start_pos_shift": [0.24, -0.08, 0.14],
  "end_final_pos_shift": [-0.23, -0.06, 0.2],
  "end_obj_pos_shift": [0, 0, 0],
  "waypts": [
  ],
  "extra_pt_count": 1,
  "optimization_device": "cpu",
  "object_mesh_file": "meshes/cubemedium_inspect_1_full_export_objectmesh.obj",
  "rotation": [0, 0, 0],
  "visuals": [
    [
      "meshes/cubemedium_inspect_1_full_export_objectmesh.obj",
      {
        "scale": [2, 2, 2],
        "pos": [3.1, -2.5, 1]
      }
    ],
    [
      "meshes/cubemedium_inspect_1_full_export_objectmesh.obj",
      {
        "scale": [1, 1, 1],
        "pos": [2.55, -2.3, 1.05]
      }
    ],
    [
      "meshes/cylindersmall_inspect_1_full_export_objectmesh.obj",
      {
        "scale": [3, 3, 3],
        "pos": [3, -2.3, 1.05]
      }
    ],
    [
      "meshes/cylindersmall_inspect_1_full_export_objectmesh.obj",
      {
        "scale": [2, 2, 2],
        "pos": [3, -2.3, 1.15]
      }
    ],
    [
      "meshes/cylindersmall_inspect_1_full_export_objectmesh.obj",
      {
        "scale": [2, 2, 2],
        "pos": [2.88, -2.3, 1.05]
      }
    ],
    [
      "meshes/cubelarge_inspect_1_full_export_objectmesh.obj",
      {
        "scale": [1, 1, 1],
        "pos": [2.6, -2.5, 0.97]
      }
    ],
    [
      "meshes/cubelarge_inspect_1_full_export_objectmesh.obj",
      {
        "scale": [1, 1, 1],
        "pos": [2.6, -2.5, 1.09],
        "rotation": [0, 0, 35]
      }
    ]
  ]
}
