{
  "agent": "trajectories",
  "task": "mug_pass",
  "scene_file": "scenes/kitchen2.xml",
  "barriers": [
    [
      "rect",
      {
        "dims": [0.05, 0.7, 0.85],
        "pos": [0.65, -1.75, 1.32]
      }
    ],
    [
      "rect",
      {
        "dims": [0.05, 0.7, 0.85],
        "pos": [0.8, -1.75, 1.32]
      }
    ],
    [
      "rect",
      {
        "dims": [0.05, 0.7, 0.85],
        "pos": [0.95, -1.75, 1.32]
      }
    ]
  ],
  "learning_rate": 0.01,
  "n_iter": 1000,
  "first_frame_iter": 1000,
  "boundary_radius": 0.1,
  "hand_boundary_radius": 0.1,
  "new_start_pos_shift": [0, 0, 0],
  "end_final_pos_shift": [0, 0, 0],
  "end_obj_pos_shift": [0, 0, 0],
  "waypts": [[[0, 0, 0.1], 0.68, 0.75], [[0, 0, 0.15], 0.7, 0.84]],
  "extra_pt_count": 0,
  "optimization_device": "cpu",
  "object_mesh_file": "meshes/mug_pass_1_full_export_objectmesh.obj",
  "rotation": [0, 0, -101.386]
}
