{
  "agent": "trajectories",
  "task": "fryingpan_cook",
  "scene_file": "kitchen2.xml",
  "barriers": [
  ],
  "learning_rate": 0.01,
  "n_iter": 1000,
  "first_frame_iter": 1000,
  "boundary_radius": 0.1,
  "hand_boundary_radius": 0.1,
  "new_start_pos_shift": [-0.23, 0.18, 0],
  "end_final_pos_shift": [0.0, 0.18, 0.01],
  "end_obj_pos_shift": [0, 0, 0.0],
  "waypts": [[[-0.1, 0, 0.2], 0.5, 0.45]],
  "extra_pt_count": 0,
  "optimization_device": "cpu",
  "object_mesh_file": "/Users/hjp/desktop/exports/s1/fryingpan_cook_2_full_export_objectmesh.obj",
  "rotation": [0, 0, 146.441]
}
