{
  "agent": "trajectories",
  "task": "fryingpan_cook",
  "scene_file": "kitchen2.xml",
  "barriers": [
    [
      "/Users/hjp/Desktop/robocasa/robocasa/models/assets/fixtures/hoods/pack_2/visuals/model_0.obj",
      {
        "scale": [1.15613, 1.06643, 1.15613],
        "pos": [2.05, -0.3, 1.94807]
      }
    ],
    [
      "rect",
      {
        "dims": [1, 0.4, 0.03],
        "pos": [3.2, -0.2, 1.405]
      }
    ],
    [
      "rect",
      {
        "dims": [0.03, 0.2, 0.15],
        "pos": [2.9, -0.2, 1.465]
      }
    ],
    [
      "rect",
      {
        "dims": [0.03, 0.2, 0.15],
        "pos": [3.15, -0.2, 1.465]
      }
    ]
  ],
  "learning_rate": 0.01,
  "n_iter": 1,
  "first_frame_iter": 200,
  "boundary_radius": 0.1,
  "hand_boundary_radius": 0.1,
  "new_start_pos_shift": [-0.23, 0.18, 0],
  "end_final_pos_shift": [0.85, 0.18, 0.52],
  "end_obj_pos_shift": [0, 0, 0.2],
  "waypts": [[[-0.2, 0, 0.0], 0.4, 0.2], [[0, 0, 0.1], 0.5, 0.4], [[0.3, 0, 0], 0.7, 0.6]],
  "extra_pt_count": 20,
  "optimization_device": "cpu",
  "object_mesh_file": "/Users/hjp/desktop/exports/s1/fryingpan_cook_2_full_export_objectmesh.obj",
  "rotation": [0, 0, 146.441]
}
