{
  "agent": "trajectories",
  "task": "teapot_pour",
  "scene_file": "scenes/kitchen2.xml",
  "barriers": [
  ],
  "learning_rate": 0.01,
  "n_iter": 1000,
  "first_frame_iter": 1000,
  "boundary_radius": 0.1,
  "hand_boundary_radius": 0.1,
  "new_start_pos_shift": [0, 0, 0],
  "end_final_pos_shift": [-2.3, 0.5, 0.0],
  "end_obj_pos_shift": [0, 0, 0],
  "waypts": [[[-2.3, 1, 0.2], 0.3, 0.3, [0, 0, -180]], [[-2.3, 1, 0.4], 0.8, 0.7]],
  "extra_pt_count": 0,
  "optimization_device": "cpu",
  "object_mesh_file": "meshes/teapot_pour_1_full_export_objectmesh.obj",
  "rotation": [0, 0, 0]
}
