{
  "agent": "trajectories",
  "task": "waterbottle_shake",
  "scene_file": "kitchen2.xml",
  "barriers": [
  ],
  "learning_rate": 0.01,
  "n_iter": 1,
  "first_frame_iter": 100,
  "boundary_radius": 0.1,
  "hand_boundary_radius": 0.1,
  "new_start_pos_shift": [0, 0, 0],
  "end_final_pos_shift": [0.5, -0.5, 0],
  "end_obj_pos_shift": [0, 0, 0],
  "waypts": [[[0.55, -0.7, 0.35], 0.35, 0.35, [70, 0, 0]], [[0.55, -0.75, 0.45], 0.36, 0.6, [50, 0, 0]], [[0.55, -0.5, 0.2], 0.45, 0.9, [-120, 0, 0]]],
  "extra_pt_count": 0,
  "optimization_device": "cpu",
  "object_mesh_file": "/Users/hjp/desktop/exports/s7/waterbottle_shake_1_full_export_objectmesh.obj",
  "rotation": [0, 0, 0]
}
