{
  "agent": "Allegro_right",
  "task": "apple_pass",
  "scene_file": "scenes/kitchen2.xml",
  "barriers": [
  ],
  "learning_rate": 0.01,
  "n_iter": 15,
  "first_frame_iter": 100,
  "boundary_radius": 0.1,
  "hand_boundary_radius": 0.1,
  "new_start_pos_shift": [0, 0, 0],
  "end_final_pos_shift": [0.3, 0, 0.12],
  "end_obj_pos_shift": [0, 0, 0],
  "waypts": [
    [[-0.1, 0, 0.5], 0.4, 0.3], [[0.4, 0, 0.5], 0.5, 0.7]
  ],
  "extra_pt_count": 1,
  "optimization_device": "cpu",
  "object_mesh_file": "meshes/apple.obj",
  "rotation": [0, 0, 0],
  "visuals": [
    [
      "meshes/model_normalized_0.obj",
      {
        "pos": [2.62, -2.1, 1.05],
        "scale": [0.23, 0.2, 0.2],
        "rotation": [0, 0, 0],
        "rgba": [0.9, 0.9, 0.95, 1]
      }
    ],
    [
      "meshes/cubelarge_inspect_1_full_export_objectmesh.obj",
      {
        "scale": [1.5, 1.5, 1],
        "pos": [2.62, -2.1, 0.98],
        "rotation": [0, 0, 35]
      }
    ]
  ]
}
