{
  "agent": "trajectories",
  "task": "mug_pass",
  "scene_file": "scenes/kitchen2.xml",
  "barriers": [
  ],
  "learning_rate": 0.01,
  "n_iter": 1000,
  "first_frame_iter": 1000,
  "boundary_radius": 0.1,
  "hand_boundary_radius": 0.1,
  "new_start_pos_shift": [0, 0, 0],
  "end_final_pos_shift": [-0.1, 0.5, -0.2],
  "end_obj_pos_shift": [0, 0, 0.2],
  "waypts": [],
  "extra_pt_count": 30,
  "optimization_device": "cpu",
  "object_mesh_file": "meshes/mug_pass_1_full_export_objectmesh.obj",
  "rotation": [0, 0, -101.386]
}
