{
  "agent": "trajectories",
  "task": "cup_pour",
  "scene_file": "kitchen2.xml",
  "barriers": [
  ],
  "learning_rate": 0.01,
  "n_iter": 1,
  "first_frame_iter": 0,
  "boundary_radius": 0.1,
  "hand_boundary_radius": 0.1,
  "new_start_pos_shift": [0, 0, 0],
  "end_final_pos_shift": [0, 0, 0],
  "end_obj_pos_shift": [0, 0, 0],
  "waypts": [[[-0.2, 0, 0.0], 0.4, 0.2]],
  "extra_pt_count": 0,
  "optimization_device": "cpu",
  "object_mesh_file": "/Users/hjp/desktop/exports/s1/cup_pour_1_full_export_objectmesh.obj",
  "rotation": [0, 0, 176.156]
}
