{
  "agent": "trajectories",
  "task": "fryingpan_cook",
  "scene_file": "scenes/kitchen2.xml",
  "barriers": [
  ],
  "learning_rate": 0.005,
  "n_iter": 1,
  "first_frame_iter": 1,
  "boundary_radius": 0.1,
  "hand_boundary_radius": 0.1,
  "new_start_pos_shift": [-0.23, 0.18, 0],
  "end_final_pos_shift": [0, 0 ,0],
  "end_obj_pos_shift": [0, 0, 0],
  "waypts": [
    [[0, 0, 0.3], 0.7, 0.1]
  ],
  "extra_pt_count": 20,
  "optimization_device": "cpu",
  "object_mesh_file": "meshes/fryingpan_cook_2_full_export_objectmesh.obj",
  "rotation": [0, 0, 146.441]
}
