{
  "agent": "trajectories",
  "task": "teapot_pour",
  "scene_file": "scenes/kitchen2.xml",
  "barriers": [
    [
      "rect",
      {
        "dims": [0.03, 0.21, 0.7],
        "pos": [2.40, -3, 0.97]
      }
    ]
  ],
  "learning_rate": 0.01,
  "n_iter": 50,
  "first_frame_iter": 1000,
  "boundary_radius": 0.13,
  "hand_boundary_radius": 0.12,
  "new_start_pos_shift": [0.05, 0, 0],
  "end_final_pos_shift": [0.05, 0, 0.0],
  "end_obj_pos_shift": [0, 0, 0],
  "waypts": [[[0, 0, 0.1], 0.3, 0.1, [0, 0, -90]], [[-0.52, 0.03, 0.22], 0.4, 0.3, [0, 0, 90]], [[-0.52, 0.03, 0.2], 0.6, 0.5], [[-0.53, -0.08, 0.2], 0.7, 0.6], [[-0.49, -0.08, 0.2], 0.75, 0.85, [0, 90, 0]], [[-0.48, -0.08, 0.2], 0.8, 0.9, [0, -90, 90]]],
  "extra_pt_count": 0,
  "optimization_device": "cpu",
  "object_mesh_file": "meshes/teapot_pour_1_full_export_objectmesh.obj",
  "rotation": [0, 0, 0],
  "visuals": [
    [
      "meshes/mug_pass_1_full_export_objectmesh.obj",
      {
        "scale": [1, 1, 1],
        "pos": [2.3, -3, 0.97]
      }
    ],
    [
      "meshes/mug_pass_1_full_export_objectmesh.obj",
      {
        "scale": [1, 1, 1],
        "pos": [2.3, -3.2, 0.97]
      }
    ]
  ]
}
