{
  "agent": "trajectories",
  "task": "teapot_pour",
  "scene_file": "kitchen2.xml",
  "barriers": [
  ],
  "learning_rate": 0.01,
  "n_iter": 1000,
  "first_frame_iter": 1000,
  "boundary_radius": 0.1,
  "hand_boundary_radius": 0.1,
  "new_start_pos_shift": [0, 0, 0],
  "end_final_pos_shift": [-2.3, 0.5, 0.0],
  "end_obj_pos_shift": [0, 0, 0],
  "waypts": [[[0, 0, 0.2], 0.3, 0.1], [[-0.47, 0.03, 0.22], 0.4, 0.3], [[-0.48, -0.08, 0.2], 0.7, 0.5], [[-1.48, -0.08, 0.2], 0.703, 0.8], [[-1.48, -0.08, 0.2], 0.71, 0.81], [[-1.48, -0.08, 0.2], 0.75, 0.85, [0, 0, -90]]],
  "extra_pt_count": 0,
  "optimization_device": "cpu",
  "object_mesh_file": "/Users/hjp/desktop/exports/s1/teapot_pour_1_full_export_objectmesh.obj",
  "rotation": [0, 0, 0],
  "visuals": [
    [
      "/Users/hjp/desktop/exports/s1/mug_pass_1_full_export_objectmesh.obj",
      {
        "scale": [1, 1, 1],
        "pos": [2.35, -3, 0.97]
      }
    ]
  ]
}
